text,label
why the fuck is bayless isoing,2
to make her feel threatened,3
omg peyton isnt good enough to help us in the playoffs! dumbass broncos fans circa december 2015.,4
fucking coward.,2
stupidly stubborn stubbornly stupid,2
i miss them being alive,1
"troll, bro. they know theyre saying stupid shit. the motherfucker does nothing but stink up libertarian subs talking shit",2
"ok, then what the actual fuck is your plan?",2
happy to be able to help.,0
pretty sure ive seen this. he swings away with the harness he is wearing. still looks painful but i think he lives,1
sorry name!,1
my brain hurts...,1
its because you play against 1000 ms ping eu players that have no idea whats going on. happy hunting!,0
the fuck is mog?!,2
especially that australia aint gonna cop it ad on tv god i hate name,2
name dude i see name so rarely that i forget that hes the og fuck this character fuck this stupid game king.,2
"wow. i just read the synopsis, and thats really what happens.",4
i kill you scum,2
tournament was a blast met some really cool people loved it all. thanks for holding it. would love to do it again someday,0
youre a disgusting piece of filth.,5
you told me it was pointless to point it out. youre the idiot,2
2019 should just be a picture of a trash can or dumpster on fire. amazing how shitty dice can make things in 10 years.,4
your coaching is terrible.... be ready and see how name uses name,3
"he may have, i was more worried about the running and shooting the ar one handed, off to the side.",3
"no problem at all, glad i could help cheers!",0
my name! this isnt a vaccine! its a jello shot!,4
"oh wow. yeah im very new, only about 8 hours gameplay",4
by name! thats name music!,0
what the fuck is name doing in the background,2
name,5
i think its cool because its a hybrid that comes in stickshift,0
wow so almost every sub has grown a lot in 7 months. also 8.3k!! what!? thats insane,4
ive never been there before so i cant confirm or deny but i would be really surprised if a casino only had limit holdem,4
go pursue that education. let name wallow in her own sadness.,1
i was suffering a delirium flu during the phantom facemask game so its all sorts of suffering for me.,1
she has at least 12 elbows and all of them are happy. you get it gurl,0
"not surprised, damn that sucks. concussions are awful.",5
they look absolutely perfect together. i hope its that way in real life too. so happy for ya name!!!,0
"no he was given a bad team to work with unfortunately, and never got the final shot he deserved",1
get him boys!,2
"at least you get sunny on netflix, they took it off in canada",1
ick! that makes me feel gross. i have addisons disease.,5
"here did you know that name slept with 35,000 women. outrageous.",4
"im scared to even ask my mom ,i might get yelled at",3
"ah, victory",0
i have his signature on my jersey. lined up at canadian tire for it when i was younger. happy retirement!,0
"they hated him, because he told them the truth",1
i am more than pleasantly surprised i clicked this link,4
i read fuck and not tuck. was wondering how the hell it wasnt creepy....,4
seeing that knife on this subreddit put the fear of name in me,3
"i feel awful posting it, but i couldnt not share",5
the sin was refusing to impregnate his brothers widow when name directly told him to. its not just about wasting semen.,5
"wow. just .. wow. read a book, sweatie!",4
he will rest easy knowing how happy he made all of us,0
"klokslag 12 i find really enjoyable, horror movie podcast, im not a horror fan but i find these dudes very entertaining",0
"i am afraid to look, but my morbid curiosity draws me to ask.",3
"frankly, partisan politics aside, i would really like to know where this fever dream of historical came from. its mind boggling.",4
this was potentially the most dangerous stunt i have ever seen someone do. one minor mistake and you die.,3
omg so glad im not alone,0
wow! thats... a lot of water my dude was your bladder ok,4
sad. my condolences to her family.,1
"i wasnt meaning it as an insult or anything, sorry if it came off that way.",1
name looked terrible that game. i was really hoping to be wrong but he came just as advertised by hawks fans,3
this stresses me out way too much.,1
ouch! that hit hard,1
"same here man, terrible feeling",3
"im glad things are coming to light, i pray justice is served for the victims.",0
"im curious to see the difference, but sadly thats not really something you can just ask someone.",1
name fucking name please no,2
i get all the deja smells and its terrible.,5
"she disrespected name, i dont like her",5
oh my god. dont you know its illegal to share memes if you dont have an iq of 16 trillion?,4
in shock and was more concerned about my kid tbh. now off course i wish id sued the arse off her for emotional distress.,4
".5x speed. every moment i enjoy would last longer and any time i find myself in a pickle, ill have more time to react appropriately.",0
"the sad thing is, relatively speaking these are actually pretty good living conditions. check out harris ranch.",1
wow.,4
old school from back when we won the cup,0
thank you for that ! im glad its just not me !,0
thank you i hate it,2
i was wondering that as well....,4
i would of taken a shit in the woods real quick,5
everyday for the last year and a half has been very hard and i should be glad shes gone. im almost there.,0
name and his supporters are the dumbest humans in the fucking galaxy. they should be locked up for their own safety.,2
its fun until youre looking back,0
"lost my kid to the system, wanna see wha the wee lassie has tae say",1
son of a bitch... here we go. cant just stand there guys....,2
hehe cheeky little guy,0
im rather surprised that these books are still being made. like i thought they died off around 2014.,4
democrips rebloodicans was my favorite.,0
oh my name,4
okay i can see this looking really cool for a festival or photos though,0
its ok we all know you suck scrub.,2
this is my favorite game of all time. thanks for bringing back some good memories!,0
you shouldnt force someone to come out you know. now look at what you did! you killed name! you bastard!,2
i know how you feel and im sorry youre going through that. but im glad you are still here,0
and then everyone clapped and cheered.,0
i enjoyed this ted talk.,0
so juicy im surprised the man from del monte isnt knocking at his door.,4
ya i hate to talk bad about dont but they should get the sticks out of their butts and make smarter decisions for their community,2
comments like these are the biggest reason i get so pissed off about fucking centrists crying about the both sides argument.,2
fuck atheist countries,2
is your job my job? because i dont know what it is about hardware stores that make ppl stupid but hell are they stupid...,2
company car? oh boy hes in trouble now.,4
"wow this was an eyeopening response, and youre right it helped us learn more, be compassionate and focus on a better wellbeing.",4
this draft is one man deep tbh. not getting zion would be devastating and a waste of a whole year.,2
i miss being practically jello as a kid,1
a year ago i said that this continuous iso by houston is disgusting to watch. it s still disgusting.,2
i once looked at the i95 and was hospitalised for weeks.,1
because majority of moves have stupidly long names. go into angel punisher into dive bomb radiance and finish the job with punishing light blade,2
what? who said i hated him? i dont give a damn about him either way.,2
wow!!!,4
"apologies, got a little carried away.",1
"oh, wow. hope nothing happens to his arms on the way!",4
"no offense, but your parents are assholes.",2
im fucking starving here.,2
no! thats horrible news!..for galaxy fans lol,1
what a coincidence. i also had a bort.,4
eat my fuck name,2
fcuk you.,2
sorry. this happens to too many good people.,1
name has a fun instagram,0
"funny, coming from the tool circle jerk reddit.",0
holy shit was that the one guy that supported remain? i didnt know we had a celebrity on this board.,4
"i forgot context and thought you meant the band was republican, please dont worry me like this again",1
spending the day with family in beautiful bowral,0
sadly my boyfriends family is the direct opposite but well still make it work 3,1
"i read this place obsessively and didnt see it, so im enjoying it and upvoting it anyway",0
the worst part is the character in the image behind it is great and this just hurts to read in his voice.,1
this is almost worse than santa con. can we get millenials to destroy this please.,2
fire the medical team.,2
also the fishing has been terrible for a month now. i am about to take the 5 story jump my friends.,5
"if he ended up with that chef, damn that will break my heart for sure.",2
"ugh, he sounds like a slob and you should leave him.",2
im so sorry about your friend. what was he like?,1
"will see,still better for chelsea then name who looked completely lost and devoid of any confidence lately",1
that sounds intelligent. wonder why you dont have a job you have to interview for.,4
"unfortunately, i dont. sorry.",1
so painful to watch,1
"really glad the us just passed transparent pricing for healthcare providers, but its just a first step.",0
wow! ive never heard of a celebrity doing something so nice,4
so glad to hear that! you go girl3,0
omg!! they are kinda turning name into new name.,4
your just killing time now.,2
im glad,0
fucking and being a boy,2
"congrats! that could not have been an easy step to take, so im so happy its been a positive experience.",0
food pranks really irk me,2
"fuck the white house, fuck mcdonalds and fuck this post.",2
"wow, michelin star for 25. thats nuts. thanks for the heads up.",4
bitch yes!,2
still wearing atm this bit has me crying! thanks for the mental image.,1
haha haha! excellent,0
that has to be the saddest nba account ever. like 4 likes every post,1
"god damn, name gets 2 mikans? lucky.",4
spent time with them. argue with them. laugh with them. cry with them. we all get lonely when we are old.,1
that is an exceedingly rare failure. i read an article about this guy. he was just stupid and stopped there.,2
"now if you can teach her english, the real fun starts.",0
im glad we have a place we can come to when we have doubts. thank you so much.,0
"wow its literally disgusting that youre getting downvoted for pointing out that she abuses her kids. this is the society we live in, eugh",5
omg is this that what older kids call sx?1?1??1??,4
imagine if we dont trade name and name fans just kill all of us.,3
what a great photo and you two look so happy.,0
thank you. and i love your flair. my toddler is the same haha,0
i cant believe only 3 people pet the cat. not even the cameraman pet the cat!,4
what the hell,2
which suggests nothing in itself. the same mods you claim are abusive are probably as hyperbolic about the racism issue as you are.,2
"believe you me. tlj is much, much worse.",5
"troo, troo....worse eban dan eat pizza wif aht a ferk.",5
yes! what the hell is it with ikea? my husband and i dont go together anymore.,2
omg lala a housewife i cant even imagine!,4
what the hell are you talking about?,2
lol top right one says its my birthday,0
"im telling ya, we really need to impose a basic hockey knowledge test to post here. im sick of the mouth breathers.",1
your son went to school in a treehouse?,4
"dont rush it .... it will eventually all fall into place, enjoy today",0
if its fan made they deserve an award. or money. something. the score is strange though,4
wow really? i watched a fair bit of kr contenders. i guess i just wasnt paying that much attention.,4
"thats the future right there, robots trying to help but destroying your whole home in the process.",5
rape kit test from six year old migrant girl revealed dna from 30 men.,1
"by ranting aimlessly on the internet about it, obviously",2
kotaku never ceases to amaze me with the horrible decisions they make in posting stories that can ruin peoples lives with no confirmation or validity.,3
"the dad is like are you fucking sorry jokes aside, good on the dad and the 2nd pissed off dude tryin to make a change",5
beautiful story arc. glad you decided to end it in my semi hometown of excelsior really neat lil town.,0
"that actually sounds like it would help, im glad it worked for you and i hope you eye is ok now",0
i dont feel alive anymore. i dont feel anything. im just numb all over. all i know is i want it to stop,1
it is. something ive wondered about many times,4
"where the mask inside, too? are air purifers not good enough for inside? sorry for the dumb question... just moved here this week.",1
im not on it i was just wondering for the sake of knowing.,4
this hurts me.,1
well fuck my kids then,2
why the fuck do people have these conversations in public,2
thats why im here in the overwatch university subreddit you fucking idiot.,2
tastes better? or maybe totally worse i dont have experience,5
"an exfriend of mine proclaimed than anyone who speaks of being raped is a horrible, unethical human being.",2
finally something nice,0
mommy bad man!!!,4
ive seen that move no less than 5 times and i still get irrationally angry at the harvard rich kid,2
i am glad your okay.,0
"weird, fbi did an investigation and proved that never happened. white knights make me cringe.",3
sorry to hear that was all it got,1
i cant believe she held out for a full 24 hours before flipflopping,4
im surprised name didnt bust that dress open when she bent down to high name,4
name!,2
"no, i dont mind all that much. i just hate being subjected to second hand carcinogens",2
if your enjoying your time with the other person then you are always on fun dates.,0
hooray for the cancer! s,0
ah what a bummer! better kill them herons spoonbills!,4
"oh my, it belongs to rcomedyheaven. laughed for a good minute",0
in draft i see a lot of enchantress. even without enchantress if lodestone demolition gets 6 dmgsame as lightning strike i am happy.,0
i hate this,2
oh gosh i heard about that and though it was absolutely disgusting,5
yeah it sort of sucks now.,2
its all fun and games until your crush turns into a spaceship.,0
wow this team has no clue what to do against this right now. there has to be 15 turnovers already.,4
ah i wish i wouldve come across one! just left though unfortunately in manchester now,1
being misunderstood really is the worst thing ever! im sorry some people are so unkind.,1
"i freakin love doing this, too!!! makes me happy for a second or two!",0
"whenever im having a bad day, i watch a few eps of cosmos to chill out.",0
"but both lost, whereas moderate sinema won. its important because without arizona there is no real path to senate majority in 2020.",0
that game hurt.,1
"so long, name",0
thats awesome. hahaha,0
"wow either name misspoke or i didnt hear correctly. i swear he said chainsaw, that is totally different from knife or cooking accident.",4
whaaaaaaat the heck was that?,2
why is it that young girls seem to idolise serial killers? i had a friend like this and never understood the attraction. its scary,3
"i would never tell anyone stick is better than pad, but speaking personally, its way more fun",0
let them argue. weve never done anything remotely as bad as most of the world does routinely.,2
"i dont give a f f the haters f all the haters much love, no hate machines within, machines within",2
dude i have a verrrrry strong feeling the barber did that on purpose. nowhere in the world is that an acceptable haircut. thats fucked up,2
its sad that we have to think of it as a miracle and not a regular occurrence,1
"you are the type of fellow that puts mommy in the cheap home and cashes her cheques, loyalty of a snake.",2
this is pretty worrying and makes me wonder why she cant. thats not normal.,3
hed hate me. my standards are even higher.,2
my worst fear when i finally get over someone those damn what ifs,3
i hate that i like them...,2
right. im surprised everyone thinks hes so cute...,4
and there i was blaming the poor black lads,1
this is a depressing rtworedditorsonecup,1
"i agree with this. im extremely happy with the hires, but i think the draft may be a bigger tell tale on how the offseason goes.",0
at least he was polite please fuck off!,2
yes! wonder how tall the girls will end up,4
wow. of course this happened,4
"well, this is the first time ive seen that in over three years.",4
name? id be surprised if he plays.,4
name i hate this,2
"fuck right off, it was illegal at the time so the law was being broken. learn to live with your actions and their consequences you whiny socialists.",2
shes a disgusting snob.. feel bad for the workers.,5
"holy fuck, report this now. the fuck you doing on reddit?",2
i wouldnt be surprised if the cheetos dust was coming out of his sweat.,4
it always makes me super happy when i see stuff like this. go live your best life girl!,0
go fuck yourself.,2
happy new years!!!!,0
damn you and your facts.,2
wow! trust issues.,4
i am. this means i will move from mtn to vodacom. and i only roam!! wow,0
exercising. yoga. meditation. walks out by myself. walking meditation good friends. time with good friends.,0
losing hope loose is what your mom is,1
fuck that guy for game 2,2
the number of pedos is too damn high!,2
in my mind. i forgot everything,1
"probably. sorry, op. but dont worry. a lot of us are in the same boat.",1
happy little lies.,0
i mean... this is some shit right here,5
this is terrible,3
"i swear of all the people that dislike artifact, the gwent crew is by far the most obnoxious.",5
"ignore him, he is a spiteful little rat who is mad because someone did something good and it reminds him how pathetic he is.",2
no one gives a fuck about your internet points guy,2
damn you! now all this dirty money is flooding frankfurt and dublin!,2
as high as 72 in black families. truly heartbreaking what the expansion of the welfare state has done to the black family.,1
that was so sad. and she kept calling for mommy the whole time. then they ditched her with grandma.,1
you get a lot more freedom and free time. college is a blast,0
thats cause name really got his career ruined by injury.,1
"this is really disgusting, the 4x4 community is one of the nicest around, shame that a few cnts gotta do shit like this.",5
too bad i do,2
sorry i was thinking of the word plaintiff,1
"hahaha, good point",0
how is one not amused by that? i cant imagine being angry even if it was my lunch. lmao...,2
oh wow i didnt know this policy was in place in the 70s!,4
"i swear ive seen this on a poster somewhere at my school, its awful",5
"yeah, this is always my first thought when i read this kind of stuff, kinda sad to be honest",1
im glad people with such foresight are the first to find this place unaffordable. good riddance.,0
"we had a clown banging on dorm windows, on campus, with a knife in 2016. was terrifying.",3
im pregnant and my dog is with my parents across the country while we renovate. the feels were too much,1
rise of agon literally the worst fucking game that man kind has ever managed to accomplish and you call him a carebear? fuck out of here.,2
oh name i unleashed the beast,3
vans are ugly as hell. you just cant make a minivan look mean. also why are they trying?,5
sorry if im late to the party but when does the new season start? im getting withdrawals! happily ever after that is.,0
"i wonder why the fuck out of this alive. well, there was a perfectly reasonable explanation.",2
jokes are even more terrible lately,5
"ouch, that looks horrible. tagged his leg on the dumpster. lucky he didnt lose a leg going that fast.",5
luckiest ive been is getting the toy i actually wanted from a mcdonalds happy meal.,0
this thought brings me too much joy. the tantrumthrowing traitor has taken me to a very dark place.,0
dont call me bitch you fucking sexist. i bet you are one of those white devils. how many women and minorities have you suppressed today?,2
"ah gotcha, you zoomed in a lot further than i expected.",4
doing a happy dance! yay!,0
happy cake day!,0
"really? in real life, shes wearing comfortable clothes with no makeup. other than that she looks the same.",4
world has turned and left me here.,1
stupid democrats!!!!!!!,2
it saddens me that name legacy has become posterboy for edgy manchilds,1
"this is sad but not cringe, i hope he finds someone to play with soon",1
what a bizarre post omg,4
"no, they couldnt hav they shouldnt have. uh...this makes me feel sick",1
yes sometimes i see amazingly detailed little faces. its so weird.,0
holy heckin heck,4
"wow, thats a big 3 year old!",4
i want my fucking cake back.,2
"cheers, name!",0
its natural to fear what is unknown. especially when someone is trying to force you to open a sketchy box while probably grinning the whole time.,3
"name, get_user_id is a moron.",2
ah good find. i guess i saw some sort of grade 9 class photo then. cheers.,0
"me, for example. i am very very happy.",0
that this ridiculous comparison is this detailed and explicit makes me think the whole beatingalittlegirlthing is part of his disgusting sexual fantasies.,5
"i was quoting him. he wanted an outsider rich business type, piss off",2
"kinda reminds me of my uncle, name.",1
sounds like a really bad time. just wait till you have a nice time and place to trip.,1
"that is so sad, just goes to show we have a lot more to learn about the other beings we share this rock with",1
i enjoy being a girl. are shutdown memes still allowed? ...no matter. couldnt find a decent one for this,0
i visibly recoiled from that.,3
shocked basement leaking got you freakin lady,4
whats the fucking point of this post? is just baseless claims with no proof to back them up.,2
everyone upvote this gotta spread the good news!!!,0
"i am glad, and enjoy. it has some pretty cool theological discussions.",0
i always thought filet mignon had bacon and garlic butter. colour me surprised deliberately ignoring anything to do with the minion,4
well then id say you have a pretty good chance if its any girl lol,0
my favorite moment in the history of the show is when he thrashed that woman.,0
and thats an issue. councils are so unrepresentative it hurts.,1
its a bitter cycle,1
i very happy with my character. i took my sweet ass time picking one that i liked.,0
"yay, now were only down by 7",0
it would be hilarious if it was a pasta place too,0
and im crying. but youre so right. thank you.,1
"i was like you man, 3 felt so bad. but street part 4 3 becomes a so bad its hilarious imo.",1
i was worried about that too honestly,3
"i remember 20082010. phones couldnt do that yet. phones had 640x480 screens back then, and believe me, we were amazed by that.",0
i never knew this! nuts are a total fear food for me,3
"they played loud music on a school night, seriously! youre backing the bastards here just to be contrary.",2
hit or miss would anybody care or miss huh..? aint nobody love me and ma dad also left me yuh...,1
look more 4th grade comments. sorry youre a child who has no brain. i bet your mother wishes she had a child who lived.,1
she should kick him out... next best thing from abortion.,2
"i know you cant read this, but i feel really bad and hope you learn to read soon",1
"come to somerset, quite a few women are cricket crazy because everybody is cricket crazy here. its weird.",5
im so sorry you were bullied in a place you should have felt safe.,1
nah no one can help me,1
wait for real? thats how they met? lol thats both terrifying and completely fitting considering how nuts they both are,3
same here. my refund almost doubled from last year. i almost cried when i saw how much im getting back.,0
your characters so broken!,2
"i wonder how that works if the seatbelt wouldnt fit even if they were sitting in a regular seat? they only go so far, right?",4
"dont worry, when you turn 20 youll look back and cringe, too.",3
"the problem is your husband. if he prioritized you, he would have figured something out. im so sorry.",1
"sorry for bringing up so many problems without any solutions, and sorry for just being whiny overall. thanks for the time youve spent talking with me",1
my soul twin must be name because im terrified of water!,3
that mightve been the worst pass hes ever thrown. yikes,5
yawn. theyre toxic together and their only trait seemed to be getting naked together.,5
the internet never disappoints.,0
thats awesome to hear,0
they killed me name. they killed me with schlock,2
i try my damndest. hard to be sad these days when i got this guy with me,1
this is blatant racism and harassment of minors. these people need to be fired.,2
just be glad youre not his wife,0
i was wondering what that was!,4
im just gonna hit back now. see you guys.,0
"those splits of marlas still amaze me! not only in terms of flexibility, but strength. just imagine how heavy that leg is...",4
now im wondering on what ive been missing out. again thank you for this.,4
mad stinky.,5
my toes hurt watching this,1
"me too, except theres no hookup. im so lonely",1
"thats just....sorry, but stupid is the only correct word.",1
i enjoyed that name kept saying name last name wrong over and over.,0
i keep hearing name is a terrible hire.,3
omg lol at least now you will be more careful before throwing out words like that. i would die.,4
"thanks, i appreciate that. its about what i expected though. sadly, im used to it.",1
i feel your pain i got scammed 1400 in november. i felt like a dumbass for falling for it too.,1
"no, i generally feel like slugging them in the head repeatedly with an iron bar. spitting is just petty. let your hatred flow!",2
yeah name is actually really cute and nice but best boi and best girl goes to name and name. just kidding. name all the way,0
what a beautiful sight that was to behold. glad i was able to attend a couple of great name performances. k signs everyone,0
that was painful.,1
"ah uthe_white_baron... i didnt read all of it, but glad i know the reference now",0
he definitely doesnt value my pleasure this is very sad,1
