text,label
mine once went 6 hours overdue. it was horrible. big hugs to you. drink all the wine you can find!,3
this is my fianc and i hate it,5
i had so many avatars named after star wars characters on millsbury. i miss it,1
glad im on my way out through atl instead!,0
im honestly surprised. we should have fallen much farther,4
she makes me cringe,3
my bitch dun left me all alone she took mah squeeky ball and mah rasty bone,2
the worst thing they risk is having to become a worker.,2
i wish i could be you. our thing is dragging on forever and im heartbroken af.,1
i remember hearing a story about this type of highway camaraderie once from a trucker who helped a woman escape a man... wonder if it was your mom,4
my soul has long been destroyed its over for us nosoulcels,1
obligatory fuck the dodgers,2
out of all the seasons i definitely feel the worst for her,5
yup this game just gets worse and worse,5
wasnt expecting these feels man. im so sorry for your loss!,1
id rather continue throwing money into these foreign sinkholes than use it to mess up the healthcare markets any further.,2
ive never cringed so hard,3
"the world is backwards, nowadays. where people defend _gangstas_ because its culturally and politically correct, and then shame those who protect and serve. makes me bleed rage.",2
fuck the rangers,2
you smug fuck,2
ive made candies almonds and cashews in a slow cooker before. theyre surprisingly not mushy or soggy.,4
that was such a misstep from their pr. wtf were they thinking people were expecting with a public countdown,2
im so glad mercys have to actually try now.,0
so youre proudly ignorant. cool bruh,5
oh man... my grandparents on both sides of the family have passed away and it was tough... were here for you,1
there would be a lot of sexual tension in faze...,5
"oh, i stand corrected half a million people is almost no one. bloody hell mate.",2
"yeah, when i saw she was in la, i really hope that. oh please, be true.",0
embrace the feels my friend. glad you found happiness even if it is fleeting.,0
worst president ever.,2
for sure...sometimes i feel like i will just evaporate into nothingness as the stranger in the mirror looks on.,1
we have seven fucking billion and more people bork every day !!,2
"i loathe him too, but i couldnt even get on board with lynching him. not even that obnoxious twat name",5
hahahaha!! i was thinking the exact same thing. but you could really feel the excitement while reading! 1010,0
this is truly terrifying.,3
"youve been a sad boi around here for the last week straight, youd do well to take a break.",1
correct what the fuck is the aaf is what im asking.,2
"its ok, glad i watched the show, i enjoyed it.",0
those mindsets are extremely dangerous to our democracy.,3
surprise! that fat woman you see on the bus every day is actually this generations name.,4
is that guildford? there always seems to be plenty of zombielike pedestrians around town!,4
i wonder why theyre single?,4
what the fuck is wrong with this?!?!?!??? fuckkkkkkkk!!!!!,2
"name damn, that is the kind of biting commentary i enjoy.",0
plus name has won before. name is a perennial loser. all he has ever done is played on teams that were the worst in the nhl.,5
so glad to hear they got banned. cant believe adults can still behave like that.,4
"name wore shoes and killed millions. for name like me, people who wear shoes have become a symbol of hatred and murder.",2
break ups are painful and theres no way to avoid that. be honest with your current girl and end it.,1
im kinda afraid to ask but did anyone reply?,3
what a load of old shite.,2
i hate when moonwolf1799 is taken.,2
my wife enjoys marking me. we just make sure they are below the collar line.,0
name getting off beat the dribble is hurting me a little inside editwords,1
"the conversion go muscle probably helped, considering the size of them. im super happy for you dude, youve done amazingly!",0
"oh my goodness, im so glad you were there too. you made his day suck a little less.",0
"its all the anger, it ages her terribly",2
"doctor is spy! grunt, too late.",4
your age difference is incredibly creepy.,5
im shocked. you mean to say the economic model adopted by every single financially successful country on the planet actually works? s,4
nope. no joke. also happy cake day,0
freedom? not in new 2013 and its gotten a lot worse since,5
im shaking and crying right now this is so powerful,3
happy one week anniversary,0
what the fuck i thought it was normal to pee before taking a shower and like not pee in the shower especially if its a shared shower ew,5
"i couldnt even get an internship for human resources without having 23 years real world experience. still in customer service, with a ton of debt.",1
i am 33 and i still regret things i said in the 5th grade.,1
im glad you had such a positive experience on the sub and congrats on the relationship.,0
my fianc had it custom made as an early valentines day gift!,0
its really hard to watch for some people because of how awkward and... just how stupid name is in this episode,5
it is an absolutely horrible ultimate i agree after 400 hours on doom i still hate it,3
i mean im no fan of the series either but who cares? it makes a lot of people happy.,0
pleased to meet you. hope you guess my name.,0
"someone will actually spend their money on this too, thats the sad part",1
crab rave ayyy ive never seen this before i kinda wanna go but seems scary.,3
yeah i dont think name wants you to fuck my wifehis girlfriend anymore you cuck,5
how did this not get marked as meta? tried posting something similar here and it was instantly flagged as meta commentary about the sub and blocked.,4
"he wants to make excuses for his affair and i doubt youll feel better after listening to him. in fact, you may actually feel worse.",5
"its creepy but also sad that the guy was bathing in your fountain, hey at least it wasnt your pool.",3
"oh look, someone who doesnt understand how living languages work.",4
the app trio is the only thing worthwhile there. won ton tacos boneless wings spinach dip and im a happy camper.,0
orange fan sad.,1
i love the burn,0
name was the worst of any sports team unis!!!,2
oh my god del monico. horrific. even the ambient smell in the hallways makes me gag.,3
how many gallons do we need is my favorite so far. the sad part is that it was always pleasant.,1
but 3 million votes!,4
i couldnt believe my ears. shes unbelievable.,4
im glad you like doing you can feel the darkness taking over haha. this honestly sounds like an animated short?,0
"when are you and dad going to pop out a few babymammas for us boys, huh? and thats the less disgusting alternative. blech!",5
i was wondering the same thing,4
unfortunately there are also far lessweaker unions now too,1
if you use one of those two i automatically hate you,2
she isnt disrespectful like name but shes also a cheater and shes making ridiculous excuses for her cheating,2
each dark souls game has been voted most likely to result in controller damage.,2
i called an ambulance for my friend without knowing it was against her wishes. she never blamed me but i felt really bad about it.,1
fuck extremists.,2
idk you seem pretty miserable and really bitter and angry. it must be exhausting and i hope you find happiness some day.,2
"thats some animal cruelty right there, someone help this poor creature.",1
curse them out.,2
very creepy horrorthemed very accurate description and only from a few second piece of an audio recording,3
"i keep wondering about armpit waxing, but the potential pain scares me.",3
im really glad the guy saved him but seeing him so pitiful and scared really lingers with me.,3
right? it was frustrating and concerning that he used such bad reasoning when his job is to curb phishing,2
ill miss name,1
"couldnt really fit this as a how to, does that mean i have to go to jail now? source",3
is this because of the sudden spate of comments feeling shocked that we dont respect proud right leaners or have you always had these mails?,4
it makes me feel good. wholesome is a very subjective thing.,0
gungrabbers? you act like theyre busting in your door and taking your guns. no one is forcing you to do this.,2
true story! thats the sad part of it...,1
twas a joke,0
hard. social anxietygeneral fearuggoness kept me from actually getting dates and i was extremely awkward when i finally stopped anxiepuking to actually go on the date.,1
im not surprised to read this within the sub its in. bunch of knuckle dragging storm troopers would be angry to see people liberate themselves. xd,2
these are the signs im getting old... wtf is a weed cartridge??,4
no im happy to spend big on myself. im not happy to spend my money on layabout benefits claimants.,0
"i may have awful taste, i would want this cake",5
theres a surprising amount of name in this thread.,4
its the top comment. how weird.,5
cool little surprise ow youtubers new hero new skins new maps next week?!,4
looks fcking delicious,0
"enough already. im sorry that the breakup is going to be painful, but you can do much better.",1
"i know he will be, im just nervous. his face is just going to be so sad",1
"wow, they are actually struggling against the hawks for 3 full quarters.",4
its so focused on the presenter and he is so unengaging its painful.,1
reddit is so right wing i cant even believe it,4
"ive had such bad memories, i remember when i remember bad times now! haha",1
im excited!,0
"cheers, guys! we are never drinking alone when we are here! but in person, i love drinking alone.",0
thats because its stupid and nobody wants it!,5
quite surprised i wasnt on there,4
only fucking merrill would miss that,2
hey just noticed.. its your 2nd cakeday slumbishop! hug,0
omg. the company logo reminded me of something. aaaaaaaaaaah.,4
i hate that. pc is way better for using the internet. i also hate how all the important features for the website missing on phone version.,5
"im sorry to hear, come see me when you die.",1
they come to your house and rob you at gun point. be honest. what are some ways that this could be resolved?,3
"no, but i might choose to not support certain teams because their owners are trash.",2
"shut up, or youll be tossed off the roof!",2
my score per minute is terrible because i only snipe so asking the wrong person. sorry dude,1
"name lives. obviously you can quote me on that, because i just said it. name dies. name dies. fuck name.",2
"its actually name , not name.. sounds like a drunk to me. glad to hear nothing horrible happened",0
how dare you say that. hes a toad of the people! not some rich frog!,2
predatory towing is getting ridiculous. i have up to date stickers for all the properties i maintain and have been towed twice. fuck em.,5
otherwise it would be a terrible disservice to the nhl,1
i wasnt even expecting the reply thats why im literally bamboozled.,4
the fact half the level has no fucking music is a real pain.,1
basic translation id rape you if i werent a virgin! super creepy.,5
racism. theyre talking about racism. the hate is the new kkk sheet.,5
which is weird because it also looks like dog treats,5
i genuinely cannot believe name didnt get fired years ago. it shocks me more than name.,4
name? rape? i am shocked i tell you! shocked!,4
"but once its born, if its parents cant afford food, shelter and medical care, it can go fuck itself.",2
...he was afraid for his life... i see he has mastered the magic incantation.,3
oh fuuuuuuuuuuuuuuuuuuuuuuuuuuuuuuuuuuuuuuuuuuuuuuuuuuuuuuuuuuuuuuuuuuuuuuuuck right off!!!!!,2
"oh, boy. you into phrenology too.",4
ah sorry about that wont happen again,1
"thats just the adrenaline. itll set in soon, haha",0
this is unironically the worst trade ive ever seen.,5
name freaking name all the people down range just staring. _ go inside dumbasses.,2
my god i thought he just hit his shins really hard on the pole but than realised what his shoulders did...,4
after reading a lot of replies you should bee ashamed of yourself. this thread is a hive of bad puns and references.,2
lmao whats the difference neither one is refrigerated. people are fucking stupid,2
"ohhhh, i like where richmond is going with that.",0
mtv has agreed to take some of the load by having them on...i wonder if they get paid per appearance or flat season fee.,4
i would like to suggest one thats like would you rather. more of a dark comedy but oh so good. cheap thrills is amazing,0
democratspf are literally hitler!!!!,2
and what a fuckton of karma it was. its fake stories like this that really prove that communism is the far superior economic system.,2
sadly the request a book of religion requires a phone number now. but if you have theirs it might work,1
fake lous!,2
i turned the news on around 6 this morning and have never been so happy to have a commute of 4 miles to my job,0
ahh you must be speaking of m w industries! i know it well ill never forget the smell of pickles.,0
wow misleading title.. ffs,4
that should be fun. i may have call in sick tomorrow. lots of bournemouth fans including my boss.,0
doctor charged 400 bucks for a blood pressure check before renewing my wifes high bp medication. she has been acting a little weird la,5
"oh, ive seen that, ugh breeders have such weird and confusing minds",5
im just here to say fuck name,2
"yeah man, fuck the man. cant have people getting free stuff or have any creative marketing ideas.",2
because the false accusation makes my anxiety worse,2
im a bioware fanboy so obviously biased. i even enjoyed andromeda. haha.,0
it doesnt surprise me given that this is the kind of establishment where staff rape the coma patients.,5
i didnt think it was that bad,5
thats so sad.,1
i would suffer a heat stroke or die of diarrhea,1
minus the eyebrows i personally think its an attractive look. but the fucking eyebrows ruin it all.,2
im glad you called it because it really is a beautiful and beautifully honest statement.,0
"i suffer from a very sexy learning disability. what do i call it, name?",1
he might be happy to discover that he is the father of someone with superpowers! lol,0
"as a fellow browns fan, unfortunate enough to be born into a browns family and in ohio... hello sharer of a lifetime of heartbreak.",1
oh man another year,4
ultimate 12 inch notices bulge owo whats this?,4
she clearly was too afraid to speak up.,3
you are so ugly even tears wont show up near you,5
omgz rite?!!1 updoots!,4
it wouldnt even have been a month yet though... i cant believe this bootlicking nonsense is upvoted here. name supporters everywhere these days smh,4
he likes an old song and is young disgusting,5
its weird because sometimes i care and sometimes i dont. although i wouldnt call myself an asexual i could be leaning more towards demisexual.,5
well this is terrifying.,3
im just saying you are demanding things of us while being nasty yourself.,2
"really wow, what a steal",4
kid has a diseasecondition where his skin falls off at the slightest touch,1
this just makes me angry.,2
"my dosage was increased 2 weeks ago and ive noticed the issues getting worse. with your comment, im really leaning towards them being side effects.",5
i am so sorry those kind of people make me sick,1
its hard to make friends. i sit alone.,1
we had a long debate about how old jackie bird is and as per every year were surprised by the result. was pish,4
hell yeah. enjoy your new bachelor life son!,0
that number 3 is soooo familiar and sad.,1
and how she cant cry bc of her expensive lashes.,1
lucky i caught people reacting on twitter. for some reason i thought this game as at 6 pm.,0
this post is bad because the only good phone is the palm pre 3 running webos,5
"thanks for gping to the effort, but i would be surprised if he read it and gave it the chance he have trump. pleasantly surprised, though.",4
...what? youre far more concerned with the o line than signing name.,4
to me the toenails is the grossest part!,5
70 year old me doesnt give a fuck just piss or get off the pot!,2
the sad thing is his is still glitched. just a couple days ago i died from name lightsaber about 5 seconds after someone else killed him.,1
gotta offload this crap somehow.,2
"name passing is worse than usual. its alright, but god damn is it painful to watch.",1
im shocked that no one got whooshed by this comment,4
i dont swallow toothpaste idiot,2
my condolences. lost my cat zoey over a year ago. i still miss her like crazy. she was only 3 years old too.,1
when are people going to learn that its ok to cheer lead dance in front of an old misogynist lol,0
"those are horrible things to say to a child, let alone a 3 yr old. i would be pissed!",3
"that goes both ways, their adrenaline and determination would also be through the fucking roof.",2
ill second this notion. one of the first things to go is texting when i start getting sad.,1
i was expecting this to go much worse than it did and im so glad my imagination wasnt right.,0
i spent a few months in la and it freaked me out every time someone zoomed past me.,0
wow i typed that out before my eyes were awake,4
hahahaha im an asshole,2
thats amazing! im so happy for him!,0
i was sad when the hawks lost name but this schottenheimer guy seems pretty cool.,1
are you being stupid again?,2
theyre disgusting people inside and out,5
we needed some way to torture a guy so a religion can be created.,2
"screw dbs swill, their creepy children of god cult employees, and the traffic mess it creates on rural in tempe",2
super creepy. and leaving the note is out of line,3
i live in raleigh and all the canes fans i know love it. so the players love it and the fans love it. everyone else can chill,0
"tool fan from the u.s. here. something seems off about this question. cheers, mate!",0
"it depresses me that the carousel revamp has been a popular answer. thats not a change, that a sliding scale adjustment.",1
"name, name and name just yelling over each other and name looking around like what the...?",2
shut up cowpoke,2
this was hard to watch but id take it over the grungy redhead talking about her full tummy,5
unless you have actual adhd lol. but i think this was mostly meant to be funny,0
hey man. a lot of people have criminals in their family. that doesnt mean they are i think you need to take a step back,2
"its rigor mortis but dont change it haha its funny, good rboneappletea material",0
your using emotionl blackmail. does the vet save cancer or destroy cancer? name vet. your using babies and all sorts of things to manipulate. vets only do the right thing.,2
oh and now vini is down,4
why is this getting downvoted. i love meepo so much.,1
glad we cleared this up,0
pilots omg... you are not alone there!,4
aww hell no. this fucking ad,2
youre an uneducated twat.,2
im afraid that will leave britain no better. cant imagine the ruckus if remain wins.,3
creepiest building in chicago. i couldnt even imagine the number of gunshot victims that have gone theough those doors and came out in a body bag.,5
"how stupid are you, if you dont ralize its staged",2
hope you had fun atleast its amazing to see up close in person compared to the camera.,0
hes got no options. not your problem. have another wine!,0
i lost a six pack this way once. for a good year every traffic stop became a field sobriety test.,1
its called a fullstop in england. my fucking immersion in this meme is ruined.,2
grandma is bad at math,5
that would expand his torso and ribs which probably hurts,1
its like bombs over baghdad to a whole new level... i love it!!,0
fuck off.,2
i cant believe its not butter.,4
"you monster, i hate it. well played.",2
"nae bother, happy to bring musical joy in to any household.....",0
"slap her hand if she is trying to force you to do anything! tell her not to put her hands on you, and enforce it every time.",2
me. i really needed to see this.,1
it is like how i imagine name and name people seeing wooden ships across the water the first time.,4
fun ruiner.,2
glad to see that name no more is a fellow ratheist user and antipeterson,0
you leave name the fuck alone.,2
good riddance. im surprised it lasted that long. name is trash.,4
sorry for your loss,1
"a surprise, to be sure, but a welcome one",4
"yeaaaahh!!!!yeaaaahhh!!!!...oh, here ya go, doomdidoom...",2
"oh i get it, you are illiterate on purpose because you fear to be fed with lies in your mind. sorry for you.",3
"yeah, the big thing im glad is he hasnt ballooned up.",0
makes us wonder what its going to be like for my childrens generation..,4
"i was expecting the surprise birthday, not seen this twist on the sister before.",4
"dont just distance yourself, block them",2
"wow, i wonder whos going on about tahiti in the background.",4
i enjoyed watching the crazy old man being dragged out at the end.,0
im suprised i didnt see more of these. thanks for the support,4
bless you this post made me cry,1
"here, here. cheers to starting fresh!",0
perfect example of the disgusting misuse of orwellian on this website,5
i am an atheist and the idea of a god makes me disgusted and angry so i prefer not to be religious,5
of course. it would mean you owe them an unspecified favor in the future. that would be horrible.,3
seahawks fans are very bad at just taking the l.,5
he looked so sad when he was talking about how it feels to be getting criticised .,1
i was also bullied at work. i was on lithium for a while. youre not alone.,1
cheers brother. thats very interesting. first time ive seen that article.,0
whats even worse the deciding voter refused to support the subway because he was strangely obsessed with a horse buggy transit plan from 1858.,2
"bro, highmountain looking sick",1
"sir the fuck down. this is an intervention, we need to talk.",2
so smart it looks like he shut his fingers in the door. thats a nasty bruise under his fingernail.,5
i hate his hoist a shit shot and throw your legs forward so you can draw a foul on the defender for crowding your landing space.,2
pls end me,1
motherfu... thanks for pointing that out!,2
all of their saints are psychotic idiot who died for nothing. people remember them as horrible people in death as they were in life.,3
i cant stand name but that was heartbreaking,1
its disgusting,5
because hes attractive. hence name come out in droves to defend him despite the fact hes a horrid asshole.,2
its almost as if everyone is too afraid to be politically incorrect to admit that height and race are a factor.,3
i knew a guy named name. always wondered what his middle name was.,4
well ya but its kinda too late for that unfortunately,1
dentist did this to me i hate it. i knew i should have waited until it wad worse but i didnt. i regret it,5
thatd be fun! meet at a bar and watch the show!,0
yeah this whole thread is gross. calling a little kid trashy or misogynistic or sexualized for liking to play dress up is just creepy and weird.,5
man being unattractive in appearance has pretty much taken any joy out of my life,1
"name i love this no one can be this happy, what a horrible person he must be",3
i wonder how big a problem this really is and what the cops plan is.,4
his hair looks fucking horrible,5
for a sec i thought i was on nosleep. im glad no one got hurt.,0
omg my 3yr old kept rubbing it all over his face the other day too!!,4
"i was shocked. they were talking earlier on the news about her losing by less than 100 being a victory, of sorts.",4
"we have a righty complaining about lefties making up bs, while they make up bs... sad.",1
thats not a fucking card?!,2
best day of the week!,0
a beautiful poem for a beautiful thing. happy cake day btw!,0
the guy that waived a future hall of famer. hard to get away from that decision.,1
was expecting a horrifically broken ankle. you have posted the actually unexpected,4
"right now im listening to stand by me, im liking it",0
"based on her other post shes young, pregnant and possibly homeless. looking for help and advice.",1
"please, please, please dont do that to yourself. youll end feeling worse when this guy leaves you.",1
"yeah, sorry about that. i see it in so many post i thought it was almost a custom to do so.",1
mother of name... im not grossed out very easily. i can stomach just about anything. but this made my fucking skin crawl....,2
glad you made the trip from a fellow austinite,0
"why are you making questionable jokes at work? unless you work in a comedy club, it really aint the place.",2
its so sad that i can play all these zelda games on my 3ds but not my switch. i have like 12 zelda games on my 3ds,1
feels good to be a nets fan right now,0
but itll hurt,1
yeah and i love my dog and id miss my dad.,1
i know this is a joke but people on this sub actually think this way lol.,0
this sounds like borderline mental health issues. scary.,3
man i hate that name guy.,2
"shouldnt have insulted chungus like that, if i see you in the fog you gon get facecamped",2
"whoops, im dying. but i wish, they make so much money.",1
the left side attack of name name was woeful,1
the bourgeoisie elected courts were going to backtrack on all name economic reforms. fuck those guys.,2
"its been good, made me able to function much much better.",0
made my day!,0
one of the rare times i actually laugh out loud while browsing online.,0
bloody forking shirtballs! this has to be some kind of the good place bad place repost robomod bullshort.,2
"hey, its working again! somebody at youtube must have given the server a whack, because suddenly the recommendations are making sense. i wonder what happened today.",0
fucking seriously.,2
i do but no one wants to play with me i at least try to play by my self but it gets really boring.,1
grandmas knees are burning up,1
"im two weeks in, hope your right, im loving the game right now",0
"ha, my husband goes out after you guys have done your thing and checks for himself, hes been burned too many times.",2
ok now im wondering what youre on,4
yeah but fgm is basically like cutting off the head of the penis entirely. im uncut myself but i get why people do it,2
