text,label
"even if you were a woman, your personality is so vile and yuck i would happily do 20 years in prison for murdering you.",5
agree. i did enjoy godless but i was addicted to the terror. it was full of such amazing character actors.,0
"well, it wasnt by 31.... so im still mad.",2
there are so many posts from name on here it makes me wonder what people think wholesome means.,4
glad shes not living in a bubble then....,0
wow. yeah does your place autograt at 8 or more ? so sorry,4
that looks like total garbage.,5
wonder where all the shit is.,4
name damn it i hate when enemy keepers use their hands and stuff to keep the ball outside their goal. make a mistake pls.,2
i know and that made me sad!,1
my whole lifes been a lie,1
glad to hear. it seems like a very hopeful sign.,0
i can do that too but i have diarrhea,1
whats the reference matter if its still insulting? glad your degree is coming in handy for something.,0
im actually surprised none of his wives have stabbed him in his sleep already. now he has secret service protection,4
"i havent seen a sign like that on mine. not that it would carry the force of law, anyway, in florida.",4
depression is being sad when theres no reason to be. losing two ws back to back now thats a reason to be sad,1
i picked up smoking again thinking it would aid that void that is working. it just made it worse.,5
name didnt finish the lps!? wow. i am in episode 20 something and was expecting him to finish,4
tell her to stop eating shit and start using mouthwash.,5
"name no, these are horrid on anyone.",3
agreed. im happy he was able to find a resolution of sorts to effectively overcome the event.,0
let me add to them it was awesome. also unexpected!,4
"theres a lot of us ladies here, unfortunately",1
"if this is actually real it is really fucking stupid.. 400mg of nicotine!? clearly youre looking for something stronger, might as well try heroin..",2
idk id kind of like name to come up next year. name still scares me a little. not saying i dont like the guy,3
she already had a child protection worker. it wasnt her first rodeo sadly.,1
glad to hear its ubiquitous and not an os thing.,0
cheers dude. upvoted!,0
i loved it so much more than i thought i would! name does an amazing job with quite a bizarre concept!,0
not ok. they could have easily given them a drug test if they really wanted to know if they were on drugs. disgusting.,5
"cheers mate, ill do that!",0
hate those things tweets.,2
that son of a bitch!,2
the only clown that make me laugh.,0
"oh wow, you are strong did you report him?",4
same. not being hateful to the op but i dont see the connection.,2
went to their other location in capitol reef national park and it was fantastic. the cauliflower dough is great even if youre not into glutenfrei.,0
mark it nsfw just to mess with people. worst title i have seen all week.,5
good news though. yesterday the devs were running test server during the morning.,0
"your imaginary boyfriend is kinda creepy. although, if hes kinky then he may be for keeps. wink",3
dj finding consistency makes me happy,0
"it cant be, i wont believe it.......this is some antivawers bullst xd",2
this inspiring.,0
"shut up, mag!",2
damn it. dont mention name. just makes me sad thinking what could have been.,1
the third picture is creepy.,3
its all good until that episode where name traps the bat on name head comes on and she screams bloody murder and wakes us up.,1
"chernobyl incident has scared everyone to death about nuclear, im curious where we would be if that never occurred.",3
i used to enjoy it and grew out of it.,0
name belongs to no one.,1
ah! i couldnt remember his name!,4
literally right after i sent it. what the hell,2
"sadly, he seems immune to bans. he also dodges them with alts like name",1
"i actually see this one a lot. allergy fire ants. me too, bro. ants will fuck you up.",2
you mean your wolfdog hybrids? kidding.,0
if id know about his kin shit i would have never been friends with him in the first place,2
she was literally the worst manager ive ever worked for,5
u.s. are going to fuck this name guy so hard...hes going to need help to remove all the stars from his rectum,2
i still cant believe that dude in whangarei is still allowed to run his business. i wonder how much longer he will keep it up.,4
this is so repulsive and disgusting. the government needs to do more to protect organising.,5
wait wait wait... did name go 6127??,4
dont you even dare try to put any blame on name,2
"im not crying, you are!!!",1
"i cannot sadly, good luck though.",1
debs a bitch,2
"how can i hate name i like name, name, and name? and name",2
im leaving to go get some more motherfucking jokes mom name,2
"i wonder if, as an added bonus, name ended the cameo with a dic pic.",4
"ive honestly looked at mine and thought, i wonder if itd keep my cup of coffee hot.",4
"its a statistically slightly worse icr, take that as you will.",5
then enjoy your shutdown!,0
wow...is that true? id love to see more on that. can you provide any links or documents on that?,4
oh man i feel bad now. if you find it funny than its funny sorry,1
that sounds disgustingly sweet and yet i want to try it,5
im happy. does that mean i can downvote?,0
"i was actually looking in to this game, glad they did this now so i can avoid it, yeesh",0
i thought this was a diary that i wrote in my notebook! im almost exactly the same!,4
i am very happy with play music. please tell me this is a lie,0
not admitting you like something because some of the fan base sucks is pretty pathetic.,5
"oh im contributing mate, dont you worry. the sub clown has been made to look like a knob again! enjoy your sunday night x",0
ugh feminism!!! surely thats the reason i cant get laid!!! see you in hell,2
i really hate ginger ale. with a passion. the scenario in that scene makes me sick to my stomach.,1
sue the shit out of her for damages to your private property.,2
my poor baby,1
"this is what makes this sub so valuable, crazy and fun.",0
"because i was a disgracefully gullible, immensely stupid fucking dipshit was am ftfy",2
crying? yeah i like crying ccalling rout yfor iserious nmental gtreatment,1
theres an arbyslong john silvers near where i live. im glad they dont cross menu items.,0
"ugh i live in wa state and now im scared im going to get measles even though im vaccinated, i hate antivaxxers",3
"it absolutely is. sadly, most players seem to only want name with different aesthetics.",1
maybe try to do some little thing you really used to enjoy. even if its just for 5 mins its still a small victory.,0
god damn i miss this game!,1
kick his ass seabass,2
will thats what that poor child was just taught. some parents have no idea,1
i wish i could tell you if it was a good t.v. let me just find the motherfucking remote!!!!!!!!,2
she must hate her father.,2
omg i could cry at this,4
i was surprised when they sewed them together instead of hot gluing them.,4
this argument makes zero sense. the same tax exclusions and exemptions that were around when the marginal rate was at 90 are not around today.,2
i miss you name,1
pretty much the person i love just broke up completely with me after how long?,1
"oh, did you not know name is the highest graded overall passrusher in this class? at any position!",4
"i work from home and live with my daughters. its so serene, but also a lot of fun because we have great times together.",0
"nah, substance abuse is sad, period.",1
this is dangerous.,3
i had a feeling...crazy what that guy can do to his body.,0
i both loathe and applaud you,5
the cheerfulness of the hail satan text overlay was unexpected.,4
oh for fucks sake.,2
because you deserve to live and be happy,0
huh. weird.,5
competitive deathmatch was a huge reaper fest last season had many games where everyone was reaper except maybe two people,1
"but something is extremely wrong if people are getting sick. might not be a sonic wave, but it definitely is something",1
"all fair enough, but you should start just cleaning your dishes straight after you use them. youll be much happier.",0
this is so tough for all of you! im so sorry!. are you in canada? i would push hard for a pediatric gastroenterologist.,1
ahhh more and more selfish,2
"im kind of struggling tonight. bored, lonely... man",1
oh i know. religion is the most severe form of brainwashing on the planet. theres absolutely nothing like it. it blows my mind.,4
"yeah, theres even more registered online. scary.",3
this picture really drives home that the cis can be super terrifying when they want to.,3
"what the fuck is this name, explain!",2
it was fucking in!!,2
yea so disgusting,5
if he doesnt give it a ten im gonna riot,2
love the almost sharingan look he gets in his eyes right before the attempt. oo i can see!,2
i sure hope so. i wanna cry tears of joy knowing name and name rode off into the sunset with one last ring.,0
"definitely. i cried. a lot. but if name existence has taught me anything, its to hold out hope!",1
coincidence..only 2 hours ago i opened a roll of us quarters ive had for a few months..16 regular pcs...and 24 states quarters. 24..quite happy.,0
i second that motion...with a vengeance!!,2
"ah, so youre the reason people hate aspies.",2
wow 4k!ds kaede looks kinda decent,4
"fuck you, usamuelzeign ! your breath smells funny.",2
tbh she kind of brought it on herself. im glad the gm came to his senses.,0
"wow, so that means common tongue isnt english!?!",4
you missed the chance to title it name,1
im just happy i have the pen to watch and listen too when the steelers are on the brink of collapsing...plus no locker room drama...,0
you stole this,2
and happy cake day.,0
"im not vegan cause i love animals, im vegan cause i hate myself.",2
try it sometime man. you may just enjoy it,0
im so homesick and i come here for photos like this.,1
tbh as creepy as this post is i was way more sexually active back when i was 1620 than i am today kids are horny idk,5
dont you know? we have to just shut up and put our heads down until they decide!,2
devastating to hear of any news like this,1
no. its creepy.,3
i cheered for the superbowl to be canceled,0
"yes, good for destiny and bungie, i wonder if they will return to microsoft, remain independent or sign with another company.",4
one of my favorite episodes.,0
oh shit. is back?! time to import,4
oh....yuck,5
"i do not see how that is disgusting. shes cleaning her self and had a discharge, so what?",5
"dog thinking shit this guy is crazy, better get out",2
"im on the receiving end of a breakup, and im not handling it well. so cheers from germany!",0
"its not something im proud of, but i definitely fucked up that day.",5
half right i am 15 but im not a goth and just enjoy the taste of human mostly blood but flesh is almost as good,0
"ill admit thats a bit surprising, since its such a massive international hub. but beggars cant be choosers i guess.",4
"you must be heartbroken, im so sorry. can you start seeing a therapist?",1
i had season seats in 230 row 2 for a solid 5 years when the pru just opened. great view of the ice. glad you had fun!,0
oh wow i didnt realize that,4
did i say he was a scammer? i said hes disgusting and theres nothing endearing about him at all. not surprised this subreddit is defending him,5
well that sucks lmao,2
"wow, the cropping on this shitpost is as bad as it gets.",5
playing competitive mtg has brought me as much joy as my children. yeah this conversation is over,0
"thats just dumb, u are stealing from people that just want to live a good life cuz other were unlucky, they were also unlucky by being born.",2
"you will watch porn again, dont try to fool me",2
im happy for you two. cheers!,0
and its not like he was a bad coach. weve been spoiled from all our great seasons.,2
you are an asshole.,2
"name damn, she must fuckin stink.",2
"yeah, that was terrible. name laughing and joking at the end of that game ended his career here.",3
weird headline. 2 children per mother would be expected to shrink the population.,5
"wow man, that is dead. you have no marriage, just a roommate. life is short, get out and find someone who meets your needs.",4
star centre name in the leadership group oh my,4
its also surprising that valve released a dud game. maybe its time for valve to grow up and introduce themselves to the digital communication age?,4
"yup, lost a whole train station inside of their houses. great loss",1
glad she was a good sport about it.,0
the real tips are always in the comments d,0
the defunct club still sit third in the overall ni league roll of honour despite not having competed for 70 years. wow,4
sports are fucking garbage. basically just religion but with jerseys and beer in public.,5
"doh, my bad",1
i was so scared to click that. yet i did.,3
. im in my early 3 exactly this. its the worst.,5
name is pretty fucking scary,3
you like name but dislike name? that is weird considering that they both are on the same low level of intelligence.,5
i shower with the lights off. the first time felt really unnatural but now its actually really comforting.,0
lol getting totes fucked up at work is super cool i am one zany individual look out shut the fuck up do it in your own time,2
id gladly exchange firsts with the suns,0
just imagine disney characters without gloves. yes its that horrifying,3
"tfw when not only is it tiny, but its damn ugly too.",5
i will happily convert to religion if i can quit my job and have unlimited food. please tell me how to accomplish this,0
"right there with you! unladylike was so depressing, i couldnt keep listening to it.",1
such a nasty woman,5
how dare anybody criticize your post in the context of your post history! recognize his privilege people!!,2
name what a piece of shit! how could you do that to an animal?!,2
i fear it is already too late if he already uses words that should hurt but really dont because of their misuse.,3
cant you tell how sad she is from her face?,1
"thats awful. im sorry that you had that experience, but yeah, mission accomplished, sorta.",5
i cant believe you won!,4
"thats sad, although im aware they historically havent been weaned off of authoritarianism.",1
you dont even deserve my attention anymore. bon voyage sucka,2
"im kind of glad they arent letting you. just you, not everyone else.",0
"no one to blame here, bad luck is what it is.",1
its crazy how many people dont know the difference between fluid ounces and weight lol,4
this gives me anxiety and heartburn just looking at it!,3
"im so glad name finally got her visa, shes going to do awesome living in the usa!!!!",0
sorry you are having such trouble.,1
i miss this show so much,1
"i hope that you find happiness, too. im happy that youve had a place to vent.",0
"marginal taxes was taught in my high school economic literacy class, its so sad that so many people dont even understand the basics of our tax system",1
i wanted to slap her when she told him she could have died and it would be his fault.,2
"acestream is a great tool, just a shame that its closed source, makes it a bit scarier for me to use.",3
really? thats very interesting,4
same.... im just perplexed,4
the sjw community. i hate it too cause they are the ancestors of the civil rights movement who where absolutely awesome,5
wow so much younger but he sounds mature,4
i cackled!!!!,0
im beginning to wonder how i lived before without these daily posts.,4
im tryin to make the community better and bring this to peoples attention hes a filthy cheater,2
no. not the i.,1
"my favorite pod when they are fresh clear. sadly, all of my recent packs look like dark brown syrup pods.",1
"sorry pal, its actually one of my least favorites",1
im happy to go without but if its readily available then everyday.,0
what a ground licker. day 9799 of being alive i still hate people.,2
sucks that name was a straight positive in important minutes and hasnt seen the floor since..,5
"fuck those people, theres no point thinking about them",2
"youre a sealion and a leftist troll. begone, and enjoy your ban.",0
looks like you got it bad. how soon till you can get out on your own?,1
"i like saying the nword, it makes me happy",0
never go to the post office. that place is hell. pay commercial plus online and order every material you need.,2
yeah it was a fun game. d,0
still saddened by the fact that we never got to see prime name vs prime name.,1
wait what? i dont get it?? help.,4
"take a shower brother, i can smell you through my phone",5
fear the turtle,3
no it really is there maybe you suck at google,2
"wow, the interview with her mom really made that clip.",4
"weird! also in winnipeg, no issues. do you have a vpn?",5
"just hit my 3pl8 squat, been looking forward to this for a long time so really happy i finally got it! now on to 4",0
enjoy the ahuahuasca,0
oh my goose! you got my super obscure reference! i literally squealed out loud when i read this comment.,4
preach my dude i know how it feels to get downvoted by the sheep,1
"wow, ap. just wow.",4
the funnyawful part is how well name works photoshopped in.,0
name looking like his fucking controller disconnected,2
that was so disgusting. vwp,5
everybody talks about this but i wonder if it increases the chances of prostate cancer. do you know?,4
"o i have one too! i didnt get anything but bullied at school, though.",1
this was a scam,2
haha! yeah scentsy is terrible!,5
luckily every elevator would be broken at all times.,0
"if one day i have daughters, i want them to be so badass that these kids! nice to see them enjoying metal!",0
im 25 and i still dont have a license. im terrified of driving and get anxiety every time im behind the wheel.,3
i wonder how fat activism intersects with animal rights tho.,4
totally fair. i would be sad in your situation. i hope you find it. youre not wrong to want those things!,1
wow! look at that spine shine! you handled her perfectly!,4
if ww3 breaks out in northern asia as people expect. it will make things worse for you guys in the states not better,5
dont be needy. talk to other girls.,2
"oh wow, thats interesting! genesis is a pretty interesting take on the luxury car market, hope the brand succeeds!",4
"normally yeah but that was my friends first match ever and to encounter such a killer, who was running noed too is kinda disheartening for him",1
name is super happy. nice.,0
the realization is pretty grim. cant say im terribly happy.,0
this is terrifying,3
youre the coward! i was the second man to walk on the moon. neil before me.,2
"yeah guys, stop complaining about violent mobs and join one!",2
"mental games. take a mental shot everytime the teacher mispronounces a word,or messes up grammatically",2
i hate that i was young enough to not remember this but old enough to remember the next super bowl....,2
it seems strange to me that name is still unsigned this close to the season.,4
"twenty some years ago, while i was pregnant with my son, tlc aired shows like a babys life. oh, the old days...",0
tv shows. and occasionally movies. i stopped interstellar at that stupid love speech. never finished it.,2
"malevolent as ive ever been, head is spinnin",5
"i am glad that youre doing well, its a difficult process but incredibly rewarding, i imagine. best of luck on your journey!",0
how could you ever get bored of place that is getting more and more enjoyable as you are there,0
that sucks. learn to check your ping like everyone else.,2
"give him 8240, ship name and name to the padres in a threeteam deal for name. boom. i solved the offseason. youre welcome.",0
"i thought so too, glad i asked.",0
what. the. actual. fuck. gags,2
always happy to help,0
"this is being said about every fucking update that lowers the skillgap. yes, it does change the game because were already affected",2
that is absolutely terrifying to me. oh my god. the idea that she was trapped as a toddler her entire life is just... wow.,3
"supernova aoc 3, the lies the media gets away with. glad someone is talking back with real umph",0
where the fuck is that kepner rocks person when we need them the most.,2
allow me to describe the shock and awe i experienced seeing this fuck no why u do this?,2
im just salty man. i hate playing houston. im sure its a nice place to live.,2
terfs smell like bigots in general. sort of a salty smell,5
none at all. i dont like kids and dont want them. i got a vasectomy and its a done deal. zero regrets,2
"how dare you interrupt the circle jerk. out, sir.",2
i am sorry human being,1
i had some pretty bad diarrhea right after the game. its was more enjoyable than that loss.,0
it makes being ugly even more pathetic. all that work just to create suffering.,2
really bad trap if noone falls for it,2
"indeed, but im worried that this matchup will end up as the biggest bait since years and rookie will crush him badly",3
theyre not likes you fucking moron.,2
i would smash both,2
and yet nobody bat an eyelid when it was name who was palling around with name. i wonder why.,4
for a second i didnt see the t in stack. was wondering how you did that but nvm.,4
"almost like name culture is written to be offensive, what with the institutionalized rape slaves and everything. they might even be the baddies.",2
oh look another shit call,2
youre a mean person.,2
youre name,1
the show paid for name surprise trip didnt they?,4
glad your a liberal supporter.,0
i will kill you all,2
honestly ive seen kids that age do really gross stuff,5
he was horrible,5
yeah that last one made me hate her the most for some reason.,2
im amazed how antigovernment these people are. they have no understanding of what government does. perhaps they should move to somalia. no government there.,4
bengals are a quirky breed,4
i completely agree! its cold at first but makes you feel so alive and invigorated by it too. its a total shock to the system.,4
"in the words of name as big as youre gonna get, so enjoy it. had to give you a career to destroy it",0
it was funny until they started to diss on chick fil a,0
"i can see how you feel , this did not teach a child to respect animals and im ashamed and upset honeslty no horse deserved that.",2
"i feel bad for her, talk to her",1
surprised he hasnt mentioned name after saying name the best managercoach hes ever worked with,4
"peeps poisoned our water supply, burned our crops, and delivered a plague unto our houses!",1
im happy for you and myself.,0
ending a relationship with a toxic person is so freeing. congratulations!,0
this is the sweetest.,0
my life is complete,0
"pressure 7 targets10 targets, popcorn, any tracking, and any tile frenzy because i enjoy trying to beat my highscore",0
sad because you dont get any women?,1
good to hear that! ive seen many ppl trashing name customer service so i was kinda worried,3
the fact someone could read your post and literally go and do this saddens me.,1
thatll be a testical festival for sure. have fun.,0
it seemed weird to me as well. its just 10mcg of cyanocobalamin with some fillers like corn starch and celulose.,5
omg this sub is gonna be my saving grace for the rest of the year. thank you so much!!,4
players like this makes me rage quit tbh.,2
the fact that name still exists is somehow the strangest thing about this,4
thats awesome. i would never have expected the prius community to be so involved.,4
that was honestly my first thought im so glad someone else went there too,0
"hey, good to see ya here!",0
but dont you see it! how dare she show two inches of skin...,2
wow if ur mom didnt come back for her card you were a goner crazy,4
oh shit. youre that bet welcher arent you?,4
its this kind of fear that made me make this,3
youre not my real mom. i dont have to listen to you. just because my dad loves you doesnt mean that i have to!,2
i never used the word mean. chill. i said weak and it is. its sad aswell.,1
i skipped the oilers game for a birthday party for a cat. im glad i did that instead.,0
she looks so happy and well rested,0
"oh no, the gig is up. im really name. lol",0
name was horrid for us,3
lol well now you have even more in common! so happy to help and hope you can smile a bit before you zzzzzzz.,0
name playing for the heat always makes me laugh,0
i think it quite apparent i was being satirical in saying mississippi.,0
happy new year everyone!,0
"if many people truly see that as a consequence, id suggest sds public name needs some work. sad.",1
the double standard. taking pictures of women without their permission is taboo and creepy.,5
you are retarded,5
unrelated but wow im so proud that i can read like 7080 percent of this because i studied chinese for 3 years. ,4
i swear denver has the worst sports media personalities.,2
a mix of useful idiots and active grifters. its a sad sign of our culture that these people make a living this way.,1
the biggest argument on your side is depreciate costs. you could challenge their concern of getting fooled by getting the car inspected by an independent.,2
like who? the one guy stranded in desert already hating his life...,2
life is strange is terrible. absolutely zero gameplay...,3
yeah my girlfriend hates it when i joke about her weight. she needs to lighten up too,0
get out asap.,2
"what an ugly shade name used to dye his hair. well, i guess it matches the infamous shirt.",5
reminds me of name from the documentary thin who purged food through a feeding tube in her stomach. this sounds dangerous.,3
"i dont care, name tweets make me uncomfortable and i hate him!!! liberals",2
wow thanks i never knew! i might try to take a tour!,4
talk about vaccines again and your next shot will be from my gun... of crystals bathed in essential oils,2
this is so cruel. i literally feel physically sick.,2
im sorry you had to go through that. though im glad youre out of that toxic environment now.,1
how dare they not have the foresight to realize hell become a president we dont like decades later.,2
everyone is sad on this sub dont take it personally if you dont get any replies.,1
