text,label
"i pirated this movie last night and can confirm its truly awful. not just lacking in good, but aggressively bad.",5
is that were its from ? all i know is since i was young that is scary af !,3
in what fucking world is this drawing not bad,2
hulu is awful for this. the volume on their commercials is deafening.,5
ngl the entire first order feels like a joke...,0
wow. you basically found my dream woman and gave her up.,4
you know im sad the name hype is over because i actually think hes been really good for us overall. i still trust him.,1
"when the gov shut down under name many were calling for his resignation. this is similar, but people already hate name so obviously people are more angry.",2
"that is so creepy and scary. imagine if he really was a dr, and the only one available in your hmo.",3
id be afraid to get high after that yo,3
"this is a person who has clearly danced a lot, i wonder what happened",4
how do you know i didnt because you posted this dumbass post. and only someone who didnt would say that,2
ooh man i miss outkast. brings me back to my childhood,1
"i was assaulted by my father once too. please dont hate yourself, it was not your fault. it was his doing.",1
omg! sounds like name was right about calling name a weirdo! that is so so odd!,4
oh name this is atrocious... i think im in love,4
then its lost man. so sad!...its terrible,1
wtf i hate name now,2
super model strange oh man,4
only issue i have is that tiramisu is a beautifully layered cake and all of that is hidden by the container,2
"sorry, semi. happy?",1
its disgusting where our society is. free tube sites need to be banned,5
"oh my name, is this the new transphobia specific post hog? because it really should be.",4
wow...u wanna say u were never toxic and u never rage okay if u can t do what i asked just go away ok???,4
i like how they roll,0
you cant.its the idiot civilian drivers fault for probably just staying behind him like a zombie. unless they come out with heated trailers soon.,2
dont worry it will work at some point haha.,0
"i should have known better, its obviously not a juul. i was just happy to see oliver tree tbh",0
this is the perfect example of something that is a terrible combination without being outright disgusting.,5
that was an awful open shot....,5
ah ha!,4
all the centrist liberals in the comments are furious...,2
"dont blame me, i voted for kodos.",2
right... so true. im sorry youre going through this too.,1
and that wig is awful,5
"such a shame. her butt was pert, cute and perfect in her vogue days. yes, i am showing my age.",5
fuck no i wanna kill the living shit out of name,2
glad we got that criminal off the streets! nogood name. tsk tsk,0
"my girlfriends creepy uncle gets extremely triggered when i point this out, or that a lot of conservatives are gigantic fudds.",2
yes!! thank you. im happy the point of this story was not lost among all.,0
"had the item hit you, i would have asked security to hold them, for you to press charges for assault. no one should be entertaining that foolishness",2
"poor lady, she was the mother of a friend of my wife, and she went to school with my father in law",1
"wow your sister is in abusive relationship, cool.",5
"which sucks, because its a bitch to find replacements for those.",2
im sorry that happened. was her hospice nurse aware that she was suffering?,1
"no, this is not polyamory. its assholery.",2
hard to believe we scored like 8 points through the first 6 minutes.,0
sad but true lol,1
cake! happy days!,0
"shut up, dont block the sanctimony train.",2
name is unbearable. i wish name had killed her.,2
that fucking mills charge is fucking bullshit,2
im sorry. your city blows.,1
thats awesome man!,0
"meh, the liga that we all knew and loved went away when name fled to italy",1
and meteor man edit hancock was a superhero movie too even though it was terrible.,5
who the hell has reddit in anything other than dark mode ??,2
"people who want a border wall idiots, racists.",2
thats horrifying,3
"seriously, check his food. it is upsetting his stomach.",2
wow! that takes guts! im so squeamish that i can hardly stand getting a shot,4
poor wee thing is probably terrified somewhere.,3
"youre just lonely, dude. dont mix that feeling with love.",1
i cant tell whos wooshing who but im afraid to ask by this point,3
actually pretty surprised that they made it fit as well as this.,4
dan cool and rich,0
i am pleased to report that my 5 win streak was broken.,1
name is a moron. why take the ball away from your best player and give arguably the best rb in the nation the chance to run it out.,2
omg i just finished and im in awe...,4
me too. i have so much shit and i cant imagine taking any of it into my car and piling it that high. wtf?,2
its what i would have wanted if i was a parent so yeah im glad i did something,0
"then there you have it. from everything i have seen thus far, this game is doomed. i hate saying that.",5
but then you regret it because you realize you secretly liked the attention. just bottom things.,1
happy cake day brother!,0
"i am serious, and dont call me name.",2
and other hilarious lies you can tell yourself...,0
"wow that is one part disgusting and another part a huge waste of time for expecting an entertaining payoff. warning, this video also includes spoilers for the latest avengers.",2
i used to do this a lot when i was younger lmao glad to see my vision wasnt just mine,0
shit he gets too close to a girl and shes liable to hit him with roach spray.,2
"haha im not expecting anything at considering theyre 2,000 miles away from me. ill be surprised if she does give me numbers,",4
"boston sports doesnt deserve anymore titles, fuck the pats",2
"one dude puked on my patio, he fell out at 2am! weak!",5
you will also be removed from a jury if you utter anything about it.,2
oh go fuck yourself with your bs generalization.,2
most likely shock that had him so comatose.,4
"wow dad, you took a baptismal for me",4
im a danger to myself,1
"ill miss you, name today is a sad day for our high sock loving brethren name",1
"its sad, but yes, zero.",1
hey just noticed.. its your 5th cakeday name! hug,0
"in reality the kid said fuck off noob, genji grandmaster main here boiii",2
youre an angry elf,2
wow 40 years at 18 wow how unfortunate.,4
? sometimes i play ffa with my friends to have fun,0
its also cruel how noone is informed about the execution at all. relatives are left completely in the dark and likely never find out about their execution.,5
"yeah i know, im just stating why it slipped my mind, im glad you brought it up.",0
theres a weird name version of this where the person falls and finds name,5
1 i think my least favorite thing our kid has done would be spit up in my mouth. 2 vomit is worse than spit up,5
"for those of us who stay, there may be more unhappiness than happiness. probably the saddest thing i ever heard.",1
"damn, that was dirty.",5
how about breaking into tears whenever one of your friends tells you they trust you because you never understood what trust meant,1
we should be happy that we moved from 4th to 5th,0
this is his worst season since his rookie year,5
it really is. i didnt know a thing about the feud and it caught me off guard how brutal it was. enjoyed it a lot though.,0
"wow, that was fast",4
shameless karma whoring.,5
no. i wishm why did i stop? kids work and money. not a minute to myself,4
"ew her text is touching her photo, what a slut",5
i enjoyed name intermission report where he was very low energy until the end when he squeaked out a hi mom d because hes the best,0
"yeah, all the stun cannonballs are horrible.",5
ashamed of being british,1
i actually have the complete collection so i can play any of them when i want to!,0
thats sex discrimination. the male class has their own bathrooms but the female does not.,2
you sound like my gf. im so lucky to have her in my life.,0
very scary.,3
could also be an overwhelming guilt in the heat of the moment. probably hard to stay rational when you realize youve killed your own friend on accident.,1
"sad really. are they really that threatened by people speaking a language? we all speak english everyday, not like we do for sectarian reasons.",1
wait there are more psychopaths in this world than are diagnosed? color me shocked,4
its kinda sad knowing that ibises are only scavenging our bins rubbish due to their natural habitats drying out.,1
holy shit! did not see that coming! gonna miss you name,1
biting the hand that feeds them,5
"i remember just feeling sick watching this, name made me cringe hard, i found name hilarious and ru looked terrible",3
i prefer console and most of my friends play cod. i still enjoy gbs every year,0
"im so happy that this worked for you! go forth, and have unashamed sex in my honour.",0
today on someone flamed me in chat,2
"fucking melb transport. i knew it would go to shit today because of the heat wave, and it did. the only bad thing about this city.",2
its a photograph with one of our greatest ever defender and captain. whats your problem?,2
"name? hes an absolute fool. if we need a coach to destroy our organization from top to bottom, hes the man.",2
i was 10 years old when this happened and seeing her heartbroken dad on tv and hearing her story still haunts me.,3
stop it. youre giving me that warm fuzzies now.,0
dirty secret. they retired the decks until they got a doozy.,5
absolutely. its exhausting.,1
"id understand if it was because of his conduct, but because of money? were the yankees, what the fuck man",2
im so glad i grew up killing infants at hospitals instead of being on my nokia,0
i wondered whatd happen if i was away for too long from camp. so cool this happens,4
"wonder if her steel balls make the same sound, clanging together, when theyre frozen?",4
and sock puppets. wow. nothing out of you is in good faith.,0
dont forget sports gambling. then well be happy.,0
all i want is to be left alone in my average home but why do i always feel like im in the twilight zone?,1
an online poll that the berners didnt manage to swarm? color me shocked.,4
"yeah, sorry for that one. some opportunities are too good to pass up.",1
"say thos mom, dad, shes busted. respect my wishes!",2
i actually want to die rn. i dont want to watch the sb but i know im going to.,1
the part where he carries her to the car had me howling! poor guy was stumbling with the weight he obviously couldnt handle,1
breaking news man write oped about whats bad for women,4
"i have seen this gif like once a week for a year, and i still cringe every time.",3
"that was such a bad yellow, he had the height and positional advantage such a bad challenge",5
im so happy you said this. i just accepted that i was going crazy.,0
shes passed away.,1
wow. you dont have any self control?,4
"sounds like my sil with mehubby. but shes a bitch and we never liked her anyways, so neither of us really care lol.",5
im wondering how many players have phd in punishment comment unironically.,4
who is bored? i happily entertain myself.,0
"yeah suck it, california",2
i feel personally attacked.,3
"name cant you see, youre being way too loud for me",2
he must really hate changing dies.,2
you seem fun.,0
"same here, she left the house we bought and is giving me till the end of the month. woooo",4
"but still, crying castrate all pedophiles because they could be potential rapists is like crying kill all men, they are all potential rapists.",1
this is doubtful...he just won with over 50 percent,4
i might be a prude. suck him off in the bathroom of your friends home! those dont equate,2
farewell wonderful traffic. its been good 2 weeks.,0
"gave ya an upvote but sadly, by reading this thread its not going to help",1
"i mean i still attend regular school, this is just a saturday school. im just frustrated that i have to waste saturday on this",2
dude wtf that was definitely off brooklyn,2
i really hate this family. nothing but snakeoil salesmen whos negative influence will reverberate for a new generation of young women who deserve better role models.,2
two horrible cunts,2
i did not even realize he was injured...,1
"thats absurd, people commit crimes blacked out on drugsalcohol all the time. also, they could just claim they dont remember it either way.",2
"i cringed so much just reading that tweet, i didnt even make it to the comments. thats my fucking president.",2
anyone else not like optics logo this year. the 2 greens look awful,5
will you two shut up? people are trying to sleep,2
i really like this play on words.,0
dont you fucken do it,2
oh my gooooooooood,4
somebody reverse this please i would be so happy.,0
"wow, talk about being name.",4
i do hate fortnite dances,2
i dont like sleeping in the couch,1
no. its not. this is disgusting behavior and anyone who supports it is a fool.,5
i really hate this jersey and it just doesnt seem like a sabres logo despite being the most accurate to the name of the team.,2
i read that as tarantula mounting and was pleasantly surprised,4
the white thing high up in the yellow square is my uncle name glass eye. wonder how it got there.,4
come back here and fight me m8,2
was that hutty from name?? ahhh that makes me so happy. love those boys e oh it was a rebound,0
i agree with everything you said. i still fell sad for her but this is the consequences of her own choices,1
they should just stop broadcasting road games,2
"what a disgusting pair of human beings, if you can even call them that",5
what a garbage post,5
heres my name. and name in front of our tree,0
"name also slept with his dads mistress, name is weird",5
i think its safe to say ive peaked. 1625 on the second half wouldnt all that surprising but i probably whiffed on name,4
"oh, sorry bud. didnt mean to be rude",1
makeup existed in 2009 too. whoever made this is stupid. i hate the whole milinials dumb shit.,2
i really cant imagine someone saying that if the gender was reversed.,4
see i hate name and got my ass kicked that game bc i couldnt use him so i was lime why me,2
legit. cant beleive that society lets those people run around free like the walking sex crimes they are.,4
"also interesting to note that name left lille for monaco, been an interesting player when ive watched lille this season",4
that poor girl who said shed help out is about to get a surprise when she finds out she has to pay for the coffee.,4
you dont go to college to learn. you go to college to have sex with college girls.,2
gang beast is really only fun with friends,0
"wow, the menacing head shake...shivers",4
youre an awful troll...,5
purposefully hurt people. name. i dont understand why anyone cares.,1
hes 30 freaking years old and is scared of managing a bank account. eyeroll,3
yall taking this way too seriously...the point is theyre both fierce.,2
"if its used as an excuse to fuck the onchain throughput, it is.",2
from one eating disorder to another. thats not recovery thats just sad.,1
lucky bastard the cool change came 5 minutes into the wedding,0
i still miss the north hills bottom dollar,1
oh my god! the pta has disbanded! ahh! ahh! ahhhhh jumps through window,4
i mean if my wife looks like that when i get married then ill be quite happy.,0
i stopped worrying about showing vulnerability years ago but theres still nobody there.,1
"ummmm wulp i personally love a feminine man. i prefer it, manly men are gross and stupid",5
omg name hes there because you dont listen. you ass!,2
doesnt suck nearly as bad as metropolitan grill. im surprised that place is still open.,4
what the fuck is this doing in a cryptocurrency sub,2
"the finest example of an egotistical, ignorant and racist piece of trash. humans like this disgust me.",5
thats really sad and shocking to hear this really embarrassed to be a human being on this earth...,1
takes away membership card how dare you sir!!!,2
"yeah i was super surprised by how good trench was, probably my top album from last year",4
i just see a car incessantly hogging the middle lane despite being undertaken on the inside!,2
they seem to have very sick laws in saudi arabia. where women dont have any protection from government against their perpetrators.,2
"name is my favorite character so im super happy they did what they did and im very happy she used her semblance, finally.",0
"dont worry, hes more afraid of you than you are of him. just act tough, itll work...maybe...",3
"they usually do hoss, hence the steak and beer hard to be sad with good food.",1
they took my favorite hair gel!! the bastards! good thing i took a picture of it beforehand just in case,2
"hope you enjoy it! try not to leave it too long though, its been taken down before.",0
my dyslexia read that as mcfucking brilliant and i was wondering if we could make it a thing.,4
did you just call me a bitch?? you will not disrespect me like this today!,2
the denials is crazy in here,2
this is ugly af sry,5
funny im on my second play through and this happens...,0
"wow, that crazy. hope this doesnt happen again with you. stay safe!",4
how dare you disparage a 3d printed jv riding a goddamn raptor,2
the secondhand panic and embarrassment i feel from this is astounding,3
better than selling our souls for a fucking trophy,2
my organs love me. i wonder how emotionally damaged a person has to be to come up with these. its weird and sad.,1
this is racist,2
weve won the afc less often than you have is a weird flex,5
this is very accurately funny and sad.,1
im glad thats not what the game is about then,0
liberals have become the very thing they accuse everyone else of. being intolerant and racist.,5
"its like 20,000 words about a teenager. fucking insanity.",2
"she havent tried contacting me in 2 years, i guess she lied. congrats to me, i won the miss you more game.",1
name is scary,3
and kat with 6. weird game.,5
old dirty bastard?,2
fuck it just marry everyone,2
read a book you fucking crook.,2
when has the altright ever been working class? its always the richest white guys who are horribly socially inept.,3
let people enjoy things,0
it kind of blew my mind to see that after reading some of the most generic advices in that post. who the f upvote these posts?,2
how dare you hate name,2
wtf did i just read? that was painful,1
i love all harper news because i love the shit storm that ensues on here.,0
i hope that the talk goes ok. though with these justnos it may not. im glad that you are prepared if it goes south.,0
get this religious bullshit out of here smh name doesnt give a fuck about who wins or losses a childs game,2
yeah but people are dumb and mesh everything together because thinking about specific situations is clearly too hard,1
youre glad australia was playing politics at a time like this? thats not a vote of confidence in the name.,0
omg i did the same exact thing lol,4
"whens he due? sorry, couldnt resist",1
but he is. he wont talk to us. name damnit op answer us!!,2
shuuuuut up this is too true,2
weird how they feel the need to announce themselves,5
im sorry what,1
bp can bulwark counter a good number of deflects and even drop attacks we have more than that to worry about,3
i just had a panic attack!,3
im glad the republican won cause i want the best high i have had 5 back surgeries and need another.,0
well thats horrific,3
im glad im not the only one who thought that.,0
"i am happy with north sydney, milsons point or kirribilli and happy with the 19th too!",0
"i sould have assissted in the stabbing, even ceasar would have been surprised by the amount of stab wounds on that little shit",4
ha ha ha. that was a good one,0
that made me cry tears of sadness and joy at the same time.,0
get out of my head.,2
im glad im not the only one that allocates points for road kills.,0
"guys, even worse he paid someone to set it up. wow.",2
this might be the worst fo in orlando magic history,5
what the fuck is the baffler? i cant even go there at work.,2
"great questions. i dont have the answer, but im happy that were starting to discuss it.",0
"cheers, brother. what are you doing to meet women?",0
"im glad you do feel genuine, unconditional love for your own child ,",0
hallelujah!!!! youve seen the light!!!!,4
it pays well and i enjoy it. i travel 6 months a year. for the last 16 years.,0
"if its anything like what happened in france, id assume because it disproportionately affects the poor.",1
i now understand why everybody gets pissed off at these weak ass pump fake fouls.,2
so happy for you both!,0
the worst is when those moments pop up randomly. especially when youre feeling happy and then a mistake you did back in 2005 comes creeping up.,2
this is the worst advice ive ever read. you should be ashamed for posting it.,5
lol kill me now,2
i love how all these suspects greet name like an old friend.,0
holy shit!!,4
woah dude!!! i would be freaking out,4
parents vaccinate your fucking kids or the next nap they take will be in a coffin omfg,2
just shut up dude,2
"just because you lack critical thinking and reading skills doesnt mean i am a moron, it means you need to learn how to think for yourself.",2
that goddamn wink slayed me. swoon so hard...,2
that face in 018. thats the face of happiness,0
oh fuck. is that legal?,4
you look like a bear.... an ugly cartoon bear,5
"some drugs people are just... scary... some drugs tend to bring out whats bubbling under the surface, so in that way, yeah.",3
why is she the absolute worst,5
and pizza. dont forget pizza. the roof of my mouth feels like a battlefield after i have eaten a hot pizza.,0
omg its hannibal cooper,4
aggressively tells friend i love them,2
"this was the one post that truly frightened me about the insane left. they are a cult, and not on our side.",3
"thats really sad to hear, i cant imagine. im wishing the best for you",1
terrifyingly accurate bot,3
"man, this analogy is frighteningly spot on. makes me sad for the province.",1
"oh, the horror! we must defend the honor of lord name against the scum of rnfl!!",3
its different because i deserve it. these same assholes in rural areas.,2
wow. a relevant and amusing garfield comic.,4
lmao guys i was coerced into sending her a picture of my junk. that just sounds dumb as hell,5
reading this made me clutch my nipples in pain,1
i just dont think we are aggressive 100 of the time,2
im so glad you werent physically hurt,0
"name wtf, its just a prank bro!",2
dude stop your gonna make me cry. this is horrible please dont do this stop right now. dont its just not worth it,3
my wife with bpd hasnt even kissed me in over a year. get used to it if youre sticking around.,1
no. going to a competitive high school was harder and more stressful than all my adult endeavors combined.,1
i remember writing on them was horrible. slight delay which threw me off combined with the letters ending up looking like crap. whiteboard was so much easier.,3
i fucking hate name,2
the first comment wasnt but when you not wanted you should just fuck off,2
sadly thats probably the worst game ive ever seen name play.,1
i think this is the first time ive ever seen this joke.,4
watching it deteriorate into a horrific dystopia. healthcare costs. dental. low wages.,3
this is horrible... one of my worst nightmares actually.,5
"only when they have dirt underneath them, now thats disgusting.",5
and those poor kids are still paying for it. and we have actual grown adults that are bullying them even today.,1
nice! im glad you liked it. have fun exploring,0
one million points for slytherin!,0
i can download ads but not the thing itself ffs,2
we lost good people on both sides,1
oh this belongs here,4
he literally laid in pain on the ground after the fight longer than the loser did,1
"ohhhhh man, too real. i spent way too many years with full on raccoon eyes and just accepting thats what makeup was.",4
"thank you so much for this link, watching name was an absolute delight!",0
i accidentally swiped. i dont have time right now i swiped for ego and got it so i dont actually want to talk to anyone.,2
its to the point where i love and i hate you,2
that was truly disgusting,5
lol at the tldr. what a crazy story. im glad the writer got some friendly new relatives out of it.,0
he can do a balloon party with his brony friends,0
some bioshock shit right here.,5
can you imagine the amount of backlash shed get if it was another name collab? omg.,4
sucks that name wont get to play name,2
yes my man,0
the nfl has been the outcome of ref interpretation and flag throwing for years. why are we surprised this continues?,4
wonder if the balls are deflated... that worked well against the colts last time.,4
"some fragile egos seem very upset at the ad. womp, womp.",1
this made me smile. i watched it on youtube.,0
you are a unique woman. happy for you that you found someone who suits you so well.,0
"exactly, last year was frustrating with our name awful home record.",5
its hard to look at. its just gross.,5
i love those possum dives!,0
"35k? thats just crazy. mine was less than 2k, and that includes the wedding dress.",4
name dude im sorry. thats their problem now. bump some name and keep moving forward.,1
"im not a brexiter. in fact, this is my concern with a second referendum. im worried that remain will lose.",3
"your character is so yuck thank you, for confirming my suspicions of whowhat you are.",5
"im happy that you got the name back, some people just dont have respect for others and think that they and their kids deserve everything",0
"you called me a troll and a liar and youre surprised that i sound antagonist and confrontational? wow, youre impressive. good talk.",4
ha me too. im afraid weve been called out,3
hys is the worst internet comments section. it makes youtube comments look like gardeners question time.,5
burn it down,2
in my few years playing i never knew this ... i feel so lost now,1
i saw your missing post and hoped you found your baby! im sorry for your heartache,1
fuck me daddy,2
yup. ive been healthier since the new year finally smh,0
im sorry to hear this. live a hell of a life for your mate,1
